{
  "schema_version": 1,
  "tool": "asr-bench",
  "role": "ai",
  "test_name": "asr-local-arabic",
  "decision_ref": 7,
  "started_at": "2026-10-20T16:40:04.601Z",
  "ended_at": "2026-10-20T17:24:26.675Z",
  "result": "info",
  "device": {
    "platform": "server",
    "model": "Intel(R) Xeon(R) Processor @ 2.10GHz, 4 threads, CPU only",
    "os_version": "Linux-6.18.44-fc-v139-x86_64-with-glibc2.39"
  },
  "upload_path": "n/a",
  "provider": "local: whisper.cpp ggerganov/whisper.cpp",
  "cost_usd": 0,
  "metrics": {
    "load_s": 1.52,
    "peak_rss_mb": 842.5,
    "threads": 4,
    "msa-read__items": 40,
    "msa-read__audio_s": 448.8,
    "msa-read__wer_pct": 7.5,
    "msa-read__cer_pct": 1.72,
    "msa-read__ref_words": 760,
    "msa-read__insertions": 1,
    "msa-read__rtf_cpu": 2.415,
    "lev-synth__items": 40,
    "lev-synth__audio_s": 230.6,
    "lev-synth__wer_pct": 25.15,
    "lev-synth__cer_pct": 4.67,
    "lev-synth__ref_words": 517,
    "lev-synth__insertions": 9,
    "lev-synth__rtf_cpu": 4.611,
    "ts-cues__items": 12,
    "ts-cues__audio_s": 383.8,
    "ts-cues__wer_pct": 21.33,
    "ts-cues__cer_pct": 9.04,
    "ts-cues__ref_words": 722,
    "ts-cues__insertions": 6,
    "ts-cues__rtf_cpu": 1.274,
    "cue_onset_err_ms_p50": 975.0,
    "cue_onset_err_ms_p95": 1671.3,
    "cue_offset_err_ms_p50": 60.0,
    "cue_offset_err_ms_p95": 950.0,
    "cue_boundary_err_ms_max": 7753.4,
    "cue_boundaries_within_500ms_pct": 59.4,
    "cue_boundaries_scored": 96,
    "entities_in_ref": 2,
    "entities_missed": 0,
    "entities_invented": 0,
    "engine": "whisper.cpp",
    "weights_revision": "5359861c739e955e79d9a303bcbc70fb988958b1",
    "weights_sha256": "394221709cd5ad1f40c46e6031ca61bce88931e6e088c188294c6d5a55ffa7e2",
    "gpu": "none detected",
    "network": "none (unshare -rn, hub offline)",
    "corpus_subset": "full"
  },
  "notes": "Public CC-BY-4.0 and synthetic audio only; no correspondent material. Corpus seed 20261020, 92 clips pinned by sha256 in tools/asr-bench/corpus.selection.json. WER/CER after the normalization in metrics.py. lev-synth is TTS speech, not field recordings; result is info, not a standard."
}
