{
  "schema_version": 1,
  "tool": "acceptance",
  "role": "qa",
  "test_name": "upload-resume",
  "started_at": "2026-10-19T19:03:38.202Z",
  "ended_at": "2026-10-19T19:03:40.821Z",
  "result": "partial",
  "metrics": {
    "interruptions": 3,
    "network_switches_simulated": 3,
    "resume_count": 3,
    "restarts_from_zero": 0,
    "bytes_sent": 67108864,
    "bytes_resent": 0,
    "resent_pct": 0,
    "chunk_size_bytes": 8388608,
    "patch_calls": 10,
    "total_time_s": 1.79,
    "sha256_match": true,
    "protocol_violations": 0,
    "hash_source": "s3"
  },
  "device": {
    "platform": "server"
  },
  "network": {
    "profile": "loopback"
  },
  "upload_path": "tusd",
  "file": {
    "size_bytes": 67108864
  },
  "notes": "تبديل الشبكة هنا إعادة بناء مجمّع الاتصالات على الجهاز نفسه؛ تغيّر العنوان الحقيقي يقيسه netlab والاختبار الميداني؛ الحجم 64 ميغابايت للتحقق الآلي؛ معيار البوابة ملف 5 غيغابايت (UPLOAD_SIZE_MB=5120)؛ tusd v2.10.1 رسمي بمخزن S3 (محاكي moto محلي) و-disable-download؛ البصمة مقروءة من S3"
}
