{
  "schema_version": 1,
  "tool": "other",
  "role": "infra",
  "started_at": "2026-10-19T19:33:22Z",
  "ended_at": "2026-10-19T19:33:58Z",
  "result": "pass",
  "device": {
    "platform": "server",
    "model": "docker compose (local)"
  },
  "metrics": {
    "rotation_total_s": 15.0,
    "api_recreate_s": 11.6,
    "hook_outage_window_s": 15.4,
    "probes_total": 152,
    "probes_failed": 22,
    "healthy_after_rotation": true,
    "secret_in_tusd_log": false,
    "within_one_hour": true
  },
  "notes": "SEC-05 rotation drill: TUSD_HOOK_SECRET rotated in infra/compose/.env, api then tusd recreated while a prober created uploads with a random token every 0.25 s (403 = hook path healthy). The outage window is the API restart: the API accepts one hook token, so tusd's hooks fail until both sides carry the new one (ADR SEC-05)."
}
