{
  "schema_version": 1,
  "tool": "acceptance",
  "role": "qa",
  "test_name": "proxy-accuracy",
  "started_at": "2026-10-26T13:45:36.098Z",
  "ended_at": "2026-10-26T13:47:00.914Z",
  "result": "partial",
  "metrics": {
    "cut_points": 10,
    "cut_matched_by_frame_index": true,
    "cut_worst_gap_ms": 0,
    "cut_tolerance_ms": 40,
    "frames_original": 489,
    "frames_proxy": 489,
    "start_pts_gap_us": 0,
    "phone_upload_s": 0.23,
    "phone_upload_to_verified_s": 0.58,
    "long_clip_proxy_ready_s": 38.66,
    "long_clip_duration_s": 120,
    "leak_hits_worker_logs": 0,
    "leak_hits_database": 0,
    "leak_hits_api": 0,
    "leak_hits_proxy_tags": 0,
    "original_unchanged": true,
    "thumbnails_present": 2,
    "thumbnail_registered": false,
    "thumbnail_leak_hits": 0,
    "failures": 0
  },
  "device": {
    "platform": "server",
    "model": "local single host: api (dev mode) + tusd 2.8 + minio + redis + postgres 16 + media worker (python, no container sandbox)"
  },
  "upload_path": "tusd",
  "file": {
    "size_bytes": 233589082,
    "duration_s": 120,
    "codec": "h264",
    "vfr": false,
    "hdr": false
  },
  "notes": "لم يُقَس: HDR بألوان صحيحة في النسخة الخفيفة، ولا ملف هاتف حقيقي (المقاطع اصطناعية من FFmpeg)؛ المصغّرتان فُحصتا وجودًا وصيغةً وغياب الوسوم، لا جودة الصورة ولا اختيار الإطار؛ تسجيل المصغّرة في الخادم يُسجَّل في المقاييس (thumbnail_registered) وليس شرطًا: الخادم لا يقبل نوع thumbnail بعد. زمن «اكتمال الرفع ← توفر النسخة الخفيفة» للمقطع الطويل رقم معلوماتي: الخطة لا تحدد له معيارًا"
}
