{
  "schema_version": 1,
  "tool": "other",
  "role": "infra",
  "started_at": "2026-10-19T20:36:27Z",
  "ended_at": "2026-10-19T20:37:02Z",
  "result": "pass",
  "device": {
    "platform": "server",
    "model": "docker compose (local)"
  },
  "metrics": {
    "rotation_total_s": 14.9,
    "api_recreate_s": 11.6,
    "hook_outage_window_s": 1.0,
    "probes_total": 151,
    "probes_failed": 5,
    "probes_failed_during_api_restart": 5,
    "probes_failed_after_api_restart": 0,
    "mode": "previous",
    "healthy_after_rotation": true,
    "secret_in_tusd_log": false,
    "within_one_hour": true
  },
  "notes": "SEC-05 rotation drill: TUSD_HOOK_SECRET rotated in infra/compose/.env, api then tusd recreated while a prober created uploads with a random token every 0.25 s (403 = hook path healthy). Mode previous: the API also accepts the old token until TUSD_HOOK_SECRET_PREVIOUS_UNTIL, so no token mismatch; failures left are the restarts themselves (one API replica in compose). ADR SEC-05."
}
