{
  "schema_version": 1,
  "tool": "web",
  "role": "web",
  "test_name": "player-choice-preliminary",
  "decision_ref": 6,
  "started_at": "2026-10-23T23:45:00Z",
  "ended_at": "2026-10-23T23:55:00Z",
  "result": "partial",
  "device": {
    "platform": "browser",
    "model": "Chrome Headless Shell 156.0.8078.47; x86_64 container",
    "os_version": "Ubuntu Linux; non-interactive headless"
  },
  "network": {
    "profile": "loopback; no throttling"
  },
  "upload_path": "n/a",
  "metrics": {
    "videojs_react_version": "10.2.0",
    "videojs_hlsjs_adapter_version": "10.2.0",
    "shaka_version": "5.3.2",
    "ffmpeg_version": "6.1.1-3ubuntu5",
    "fixture_cases": 2,
    "fixture_worker_revision": "c6df46cf7d43c6cdcb16f8b7528eb187de68a203",
    "vfr_source_start_pts_us": 2000000,
    "fixture_width": 854,
    "fixture_height": 480,
    "hls_segments_per_case": 3,
    "thumbnail_cues_per_case": 7,
    "caption_cues_per_case": 3,
    "videojs_hlsjs_vfr_playback_observed": true,
    "shaka_vfr_playback_observed": true,
    "videojs_hlsjs_hdr_playback_observed": true,
    "shaka_hdr_playback_observed": true,
    "videojs_vfr_decoded_frames_at_probe": 32,
    "shaka_vfr_decoded_frames_at_probe": 31,
    "videojs_hdr_decoded_frames_at_probe": 38,
    "shaka_hdr_decoded_frames_at_probe": 36,
    "videojs_relative_sprite_loaded": false,
    "shaka_relative_sprite_loaded": true,
    "shaka_sprite_natural_width": 1600,
    "arabic_native_cue_at_5s_observed": true,
    "shaka_ui_mixed_rtl_visual_pass": false,
    "videojs_hlsjs_standalone_js_gzip_bytes": 370814,
    "videojs_standalone_css_gzip_bytes": 8786,
    "shaka_standalone_js_gzip_bytes": 372873,
    "shaka_upstream_css_gzip_bytes": 7535,
    "shaka_upstream_external_font_attempt_observed": true,
    "shaka_font_removal_rerun_complete": false,
    "shaka_space_play_pause_observed": true,
    "keyboard_suite_complete": false,
    "safari_real_tested": false,
    "webkit_tested": false,
    "chrome_interactive_tested": false,
    "bff_hls_real_material_tested": false,
    "production_player_replaced": false
  },
  "notes": "نتائج استكشافية من سجل تشغيل محلي قبل إعادة تهيئة بيئة العمل؛ لا ادعاء بقبول أو توقيت أداء. العينات اصطناعية بكود العامل غير المعدّل، لكن FFmpeg المحلي 6.1.1 وليس صورة العامل المثبتة على 8.0.1. Chromium 141 المتاح لم يدعم H.264؛ Chrome المكتبي تعذر تشغيله بسبب قيود socket؛ القياس الفعلي استعمل Chrome Headless Shell 156.0.8078.47. WebKit لم يعمل لنقص مكتبات النظام، وSafari لم يُقَس. أرقام الحزم قبل حذف تعريف Roboto من CSS، ويلزم إعادة القياس على الشيفرة النهائية. لا ملفات مراسلين ولا قياس شبكة ميدان. صور المعاينة ظهرت مع Shaka؛ Video.js طلب sprite.jpg نسبة إلى صفحة التجربة. النص العربي المختلط يحتاج ضبط اتجاه في Shaka UITextDisplayer. لا توجد شهادات اختبار نهائية؛ التحويل في صفحة المادة ينتظر اكتمال المقارنة وعقد تفويض أعضاء HLS."
}
