{
  "schema_version": 1,
  "tool": "other",
  "role": "media",
  "test_name": "media-tonemap-choice",
  "started_at": "2026-10-26T13:35:05.897Z",
  "ended_at": "2026-10-26T13:38:29.173Z",
  "result": "pass",
  "device": {
    "platform": "server",
    "model": "4 vCPU"
  },
  "upload_path": "n/a",
  "file": {
    "duration_s": 10.0,
    "codec": "hevc",
    "vfr": false,
    "hdr": true
  },
  "metrics": {
    "sdr_reference_mean": 127.8,
    "sdr_reference_p95": 226,
    "hable_hlg_mean_delta_pct": -36.6,
    "hable_hlg_p95_delta_pct": -40.7,
    "hable_hlg_bright_clipped_pct": 0.0,
    "hable_hlg_bright_levels_above_180": 35,
    "hable_pq_mean_delta_pct": -36.5,
    "hable_pq_p95_delta_pct": -40.7,
    "hable_pq_bright_clipped_pct": 0.0,
    "hable_pq_bright_levels_above_180": 35,
    "hable_within_limit": false,
    "mobius_hlg_mean_delta_pct": -12.5,
    "mobius_hlg_p95_delta_pct": -19.0,
    "mobius_hlg_bright_clipped_pct": 0.0,
    "mobius_hlg_bright_levels_above_180": 58,
    "mobius_pq_mean_delta_pct": -12.5,
    "mobius_pq_p95_delta_pct": -19.5,
    "mobius_pq_bright_clipped_pct": 0.0,
    "mobius_pq_bright_levels_above_180": 60,
    "mobius_within_limit": false,
    "reinhard_hlg_mean_delta_pct": -19.0,
    "reinhard_hlg_p95_delta_pct": -25.2,
    "reinhard_hlg_bright_clipped_pct": 0.0,
    "reinhard_hlg_bright_levels_above_180": 51,
    "reinhard_pq_mean_delta_pct": -19.0,
    "reinhard_pq_p95_delta_pct": -25.2,
    "reinhard_pq_bright_clipped_pct": 0.0,
    "reinhard_pq_bright_levels_above_180": 53,
    "reinhard_within_limit": false,
    "mobius_07_hlg_mean_delta_pct": -4.0,
    "mobius_07_hlg_p95_delta_pct": -10.6,
    "mobius_07_hlg_bright_clipped_pct": 0.01,
    "mobius_07_hlg_bright_levels_above_180": 68,
    "mobius_07_pq_mean_delta_pct": -3.9,
    "mobius_07_pq_p95_delta_pct": -10.2,
    "mobius_07_pq_bright_clipped_pct": 0.02,
    "mobius_07_pq_bright_levels_above_180": 69,
    "mobius_07_within_limit": false,
    "mobius_08_hlg_mean_delta_pct": -2.3,
    "mobius_08_hlg_p95_delta_pct": -8.4,
    "mobius_08_hlg_bright_clipped_pct": 0.02,
    "mobius_08_hlg_bright_levels_above_180": 70,
    "mobius_08_pq_mean_delta_pct": -2.1,
    "mobius_08_pq_p95_delta_pct": -8.0,
    "mobius_08_pq_bright_clipped_pct": 0.03,
    "mobius_08_pq_bright_levels_above_180": 71,
    "mobius_08_within_limit": true,
    "mobius_09_hlg_mean_delta_pct": -0.8,
    "mobius_09_hlg_p95_delta_pct": -6.2,
    "mobius_09_hlg_bright_clipped_pct": 0.04,
    "mobius_09_hlg_bright_levels_above_180": 72,
    "mobius_09_pq_mean_delta_pct": -0.7,
    "mobius_09_pq_p95_delta_pct": -6.2,
    "mobius_09_pq_bright_clipped_pct": 0.04,
    "mobius_09_pq_bright_levels_above_180": 72,
    "mobius_09_within_limit": true,
    "reinhard_08_hlg_mean_delta_pct": -3.0,
    "reinhard_08_hlg_p95_delta_pct": -11.9,
    "reinhard_08_hlg_bright_clipped_pct": 0.01,
    "reinhard_08_hlg_bright_levels_above_180": 66,
    "reinhard_08_pq_mean_delta_pct": -2.9,
    "reinhard_08_pq_p95_delta_pct": -11.5,
    "reinhard_08_pq_bright_clipped_pct": 0.01,
    "reinhard_08_pq_bright_levels_above_180": 67,
    "reinhard_08_within_limit": false,
    "reinhard_09_hlg_mean_delta_pct": 2.1,
    "reinhard_09_hlg_p95_delta_pct": -8.0,
    "reinhard_09_hlg_bright_clipped_pct": 2.53,
    "reinhard_09_hlg_bright_levels_above_180": 70,
    "reinhard_09_pq_mean_delta_pct": 2.2,
    "reinhard_09_pq_p95_delta_pct": -7.5,
    "reinhard_09_pq_bright_clipped_pct": 2.53,
    "reinhard_09_pq_bright_levels_above_180": 69,
    "reinhard_09_within_limit": true,
    "chosen": "mobius:param=0.8:desat=0",
    "operators_within_limit": "mobius:param=0.8:desat=0, mobius:param=0.9:desat=0, reinhard:param=0.9:desat=0",
    "max_delta_pct": 10,
    "ffmpeg_version": "8.0.1"
  }
}
